{
  "id": "enemy_boneco_alvo",
  "versao": 1,
  "nota": "Alvo de treino (gameplay.md §11.1-11): fixo, não ataca; contador de acertos no debug. Lógica de dano é do 03.",
  "sprite": "enemy_boneco_alvo",
  "tipo": "alvo_treino",
  "caixas": { "pushbox_raio_tiles": 0.4, "hurtbox_raio_tiles": 0.4, "hurtbox_altura_tiles": [0, 1.4] }
}
